{
  "footprint": {
    "convex_hull": [
      [-1.36, 0.85],
      [-1.36, -0.85],
      [1.36, -0.85],
      [1.36, 0.85]
    ]
  },
  "shape": {
    "vertices": [
      [-1.3671875, 0.12125492, 1.3581855],
      [-1.3671875, 0.12125492, -1.7687109],
      [1.3671875, 0.12125492, -1.7687109],
      [1.3671875, 0.12125492, 1.3581855],
      [-1.3671875, 2.8423772, 1.3581855],
      [-1.3671875, 2.8423772, -1.7687109],
      [1.3671875, 2.8423772, -1.7687109],
      [1.3671875, 2.8423772, 1.3581855]
    ],
    "indices": [
      [4, 5, 0],
      [5, 1, 0],
      [5, 6, 1],
      [6, 2, 1],
      [6, 7, 3],
      [2, 6, 3],
      [7, 4, 0],
      [3, 7, 0],
      [0, 1, 2],
      [3, 0, 2],
      [7, 6, 5],
      [4, 7, 5]
    ]
  },
  "cannon": {
    "muzzle": [
      0.0,
      1.0,
      0.0
    ],
    "range": 50.0,
    "damage": 3.0,
    "charge_time_sec": 2.5,
    "discharge_time_sec": 10.0
  },
  "flight": {
    "min_height": 2.0,
    "max_height": 5.0
  }
}
